{
  "schemaVersion": 1,
  "id": "dnd.collections.feats.part02",
  "version": "1.0.0",
  "type": "collection",
  "collectionCategory": "feats",
  "members": [
    "dnd.feat.scion_of_the_outer_planes",
    "dnd.feat.chef",
    "dnd.feat.eldritch_adept",
    "dnd.feat.fey_touched",
    "dnd.feat.shadow_touched",
    "dnd.feat.fighting_initiate",
    "dnd.feat.metamagic_adept",
    "dnd.feat.gunner",
    "dnd.feat.piercer",
    "dnd.feat.poisoner",
    "dnd.feat.skill_expert",
    "dnd.feat.telekinetic",
    "dnd.feat.telepathic",
    "dnd.feat.alchemist",
    "dnd.feat.arcane_marksman",
    "dnd.feat.berserker",
    "dnd.feat.brawler",
    "dnd.feat.empath",
    "dnd.feat.fast_movement",
    "dnd.feat.gourmand",
    "dnd.feat.harper_agent",
    "dnd.feat.master_of_disguise",
    "dnd.feat.medic",
    "dnd.feat.necromantic_scholar",
    "dnd.feat.perceptive",
    "dnd.feat.pyromaniac",
    "dnd.feat.sea_faring",
    "dnd.feat.silver_tongue",
    "dnd.feat.stealthy",
    "dnd.feat.survivalist",
    "dnd.feat.tough_hide",
    "dnd.feat.unarmored_defense_feat",
    "dnd.feat.zealot",
    "dnd.feat.arcane_defender",
    "dnd.feat.divine_interventionist",
    "dnd.feat.shadow_dancer",
    "dnd.feat.beast_tamer",
    "dnd.feat.runic_carver",
    "dnd.feat.storm_herald",
    "dnd.feat.blood_hunter",
    "dnd.feat.bardic_inspiration_feat",
    "dnd.feat.monastic_training",
    "dnd.feat.warlock_pact_initiate",
    "dnd.feat.artisan_genius",
    "dnd.feat.gladiator",
    "dnd.feat.nomad",
    "dnd.feat.duelist_master",
    "dnd.feat.shield_bash_master",
    "dnd.feat.shadow_strike",
    "dnd.feat.holy_warrior"
  ]
}
