{
  "schemaVersion": 1,
  "id": "dnd.collections.races",
  "version": "1.0.0",
  "type": "collection",
  "collectionCategory": "races",
  "members": [
    "demo.race.lanternfolk",
    "dnd.race.aasimar",
    "dnd.race.firbolg",
    "dnd.race.goliath",
    "dnd.race.kenku",
    "dnd.race.tabaxi",
    "dnd.race.triton",
    "dnd.race.tortle",
    "dnd.race.changeling",
    "dnd.race.kalashtar",
    "dnd.race.warforged",
    "dnd.race.genasi_air",
    "dnd.race.genasi_earth",
    "dnd.race.genasi_fire",
    "dnd.race.genasi_water",
    "dnd.race.plasmoid",
    "dnd.race.autognome",
    "dnd.race.githyanki",
    "dnd.race.githzerai",
    "dnd.race.loxodon",
    "dnd.race.simic_hybrid",
    "dnd.race.myconid",
    "dnd.race.vedalken",
    "dnd.race.kender",
    "dnd.race.aarakocra",
    "dnd.race.hadozee",
    "dnd.race.shifter",
    "dnd.race.bugbear",
    "dnd.race.goblin",
    "dnd.race.hobgoblin",
    "dnd.race.kobold",
    "dnd.race.full_orc",
    "dnd.race.yuan_ti",
    "dnd.race.lizardfolk",
    "dnd.race.dhampir",
    "dnd.race.hexblood",
    "dnd.race.reborn",
    "dnd.race.satyr",
    "dnd.race.minotaur",
    "dnd.race.centaur",
    "dnd.race.fairy",
    "dnd.race.harengon",
    "dnd.race.owlin"
  ]
}
