{
  "schemaVersion": 1,
  "id": "dnd.collections.feats.part01",
  "version": "1.0.0",
  "type": "collection",
  "collectionCategory": "feats",
  "members": [
    "dnd.feat.alert",
    "dnd.feat.athlete",
    "dnd.feat.actor",
    "dnd.feat.charger",
    "dnd.feat.crossbow_expert",
    "dnd.feat.defensive_duelist",
    "dnd.feat.dual_wielder",
    "dnd.feat.dungeon_delver",
    "dnd.feat.durable",
    "dnd.feat.elemental_adept",
    "dnd.feat.great_weapon_master",
    "dnd.feat.healer",
    "dnd.feat.heavily_armored",
    "dnd.feat.heavy_armor_master",
    "dnd.feat.inspiring_leader",
    "dnd.feat.keen_mind",
    "dnd.feat.lightly_armored",
    "dnd.feat.linguist",
    "dnd.feat.lucky",
    "dnd.feat.mage_slayer",
    "dnd.feat.magic_initiate",
    "dnd.feat.martial_adept",
    "dnd.feat.medium_armor_master",
    "dnd.feat.mobile",
    "dnd.feat.moderately_armored",
    "dnd.feat.mounted_combatant",
    "dnd.feat.observant",
    "dnd.feat.polearm_master",
    "dnd.feat.resilient",
    "dnd.feat.ritual_caster",
    "dnd.feat.savage_attacker",
    "dnd.feat.sentinel",
    "dnd.feat.sharpshooter",
    "dnd.feat.shield_master",
    "dnd.feat.skilled",
    "dnd.feat.skulker",
    "dnd.feat.spell_sniper",
    "dnd.feat.tavern_brawler",
    "dnd.feat.tough",
    "dnd.feat.war_caster",
    "dnd.feat.weapon_master",
    "dnd.feat.flame_touched",
    "dnd.feat.aberrant_dragonmark",
    "dnd.feat.greater_dragonmark",
    "dnd.feat.revenant_blade",
    "dnd.feat.squire_of_solamnia",
    "dnd.feat.knight_of_the_sword",
    "dnd.feat.knight_of_the_rose",
    "dnd.feat.initiate_of_high_sorcery",
    "dnd.feat.strike_of_the_giants"
  ]
}
